<?xml version="1.0" encoding="UTF-8"?>
<root
    xmlns:xsi='http://www.w3.org/2001/XMLSchema-instance'
    xsi:noNamespaceSchemaLocation='data.xsd'>
<date>
        <Nume>Popescu</Nume>
        <Prenume>Ion</Prenume>
        <Username>pion</Username>
    </date>
    <date>
        <Nume>Georgescu</Nume>
        <Prenume>Mihai</Prenume>
        <Username>gmihai</Username>
    </date>
    <date>
        <Nume>Ionescu</Nume>
        <Prenume>Bogdan</Prenume>
        <Username>ibogdan</Username>
    </date>


</root>
